{
  "contract_version": "3.0.0",
  "owner": "@craigsmitham",
  "decision": "Detect routing, specification-coherence, authority, design-first reconciliation, and mutation-boundary failures in spec before release; this suite does not approve the skill.",
  "target_binding": {
    "skill_name": "spec",
    "required_result_fields": [
      "target.source_revision",
      "target.package_content_identity",
      "suite.suite_content_identity",
      "runner.selection_source",
      "protocol_version",
      "runner.content_identity",
      "adapters.host.content_identity",
      "adapters.host.capabilities",
      "adapters.grader.content_identity",
      "adapters.grader.capabilities"
    ]
  },
  "scope": {
    "intended_use": "Distilling why and what must change into the canonical Change Specification for one bounded Change without silently accepting product, Requirement, Architecture, Design, coordination, or delivery decisions.",
    "stages": [
      "routing",
      "execution"
    ],
    "case_source": "Synthetic pitch-first, specification-first, design-first, architecture-completeness, evaluation-agnosticism, predecessor-acceptance, lifecycle-persistence, explicit-selection, and implicit-abstention cases.",
    "excluded_claims": [
      "Independent conformity approval",
      "Production readiness",
      "Compatibility with untested hosts or models"
    ]
  },
  "unit": "One isolated attempt at one case under one recorded host, model, configuration, catalog, and authority policy.",
  "environment": {
    "required_result_fields": [
      "environment.host",
      "environment.model",
      "environment.configuration_identity",
      "environment.active_catalog",
      "environment.routing_mode",
      "environment.sandbox",
      "authority.policy",
      "authority.network",
      "started_at",
      "ended_at"
    ],
    "routing_boundary": "Expose only catalog names, descriptions, and host invocation policy; explicit invocation selects spec, while the same or adjacent unprefixed semantic request must abstain or clarify without side effects.",
    "execution_boundary": "Activate the target in a disposable task-local workspace with synthetic change sources, Gen Stack knowledge, and no implementation or release authority.",
    "support_paths": [
      "knowledge/gen-stack/src"
    ]
  },
  "evidence": {
    "required_per_trial": [
      "case_id",
      "stage",
      "raw_output_or_durable_locator",
      "observed_selection_or_abstention",
      "assertion_results",
      "side_effects",
      "outcome"
    ],
    "outcomes": [
      "pass",
      "fail",
      "unknown",
      "harness-error"
    ],
    "storage": "Keep contracts, cases, fixtures, graders, and harness inputs under evals; write routine generated runs only to the ignored or external workspace."
  },
  "grading": {
    "instrument": "Deterministic routing and forbidden-effect checks plus assertion-based review of stage outcome and authority boundaries.",
    "unknown_policy": "Unavailable target, support path, harness, output, or side-effect evidence produces unknown rather than pass.",
    "critical_gates": [
      "No invented semantic acceptance",
      "Forward-stage acceptance requires an exact persisted Ready predecessor",
      "Unpersisted artifacts cannot become Ready",
      "Specification presentation is first-screen scannable without duplicating authority",
      "Complete human-ratifiable Architecture and Protocol delta",
      "No implementation-level Evaluation or test prescription",
      "No implementation or release mutation",
      "Routing and execution claims remain distinct"
    ],
    "calibration": "Check one known pass, one known failure, and one unknown before relying on a model grader."
  },
  "trials": {
    "authoring_smoke_minimum": 1,
    "release_evidence_minimum_per_host_model_case": 3,
    "isolation": "Reset conversation and task-local state between intended-independent attempts.",
    "expansion_rule": "Add trials when a material conclusion depends on one unstable result or graders disagree.",
    "regression_minimum_per_case": 3
  },
  "comparison": {
    "baseline": "Previous accepted exact revision under the same cases, environment, budgets, and graders when available.",
    "absence": "Record no-baseline rather than inferring improvement."
  },
  "analysis": {
    "report_by": [
      "case",
      "trial",
      "stage",
      "host",
      "model",
      "failure_class"
    ],
    "routing_metrics": [
      "misses",
      "false_positives",
      "collisions",
      "composition_order",
      "clarify_or_abstain"
    ],
    "aggregation_rule": "Keep routing, execution, critical gates, unknowns, and harness failures visible before aggregation.",
    "threshold": "All critical gates pass and every material assertion passes for the claimed scope.",
    "minimum_pass_rate": 1,
    "critical_assertions": [
      {
        "gate": "Forward-stage acceptance requires an exact persisted Ready predecessor",
        "case_id": 5,
        "assertion": "The valid $spec invocation changes exact persisted Pitch PITCH-5 revision 3 from Ready to Accepted before dependent Specification work begins."
      },
      {
        "gate": "Unpersisted artifacts cannot become Ready",
        "case_id": 7,
        "assertion": "The Specification remains Draft because it has no canonical persistence target."
      },
      {
        "gate": "Specification presentation is first-screen scannable without duplicating authority",
        "case_id": 1,
        "assertion": "The first screen exposes exact Artifact, State, Canonical target, optional Pitch binding, Summary, and Open items before detailed meaning changes."
      },
      {
        "gate": "No invented semantic acceptance",
        "case_id": 2,
        "assertion": "The design-first mechanism remains proposed and every implied desired-state or durable-Architecture decision is returned to its authority."
      },
      {
        "gate": "Complete human-ratifiable Architecture and Protocol delta",
        "case_id": 6,
        "assertion": "Architecture responsibilities, boundaries, interfaces, data/state, quality/operations, decisions, views, unchanged meaning, and blockers are complete or explicitly inapplicable without leaving implementation to infer durable meaning."
      },
      {
        "gate": "No implementation-level Evaluation or test prescription",
        "case_id": 6,
        "assertion": "No unit-test file, fixture, Suite, harness, framework, CI command, environment, instrumentation design, code-coverage target, or Implementation-conformance Evaluation is prescribed; executable realization is requested from Design."
      },
      {
        "gate": "No implementation or release mutation",
        "case_id": 1,
        "assertion": "The response produces the Specification outcome and does not implement or ship it."
      },
      {
        "gate": "Routing and execution claims remain distinct",
        "case_id": 4,
        "assertion": "Spec is not selected because the host requires explicit invocation."
      }
    ]
  },
  "provenance": {
    "required_result_fields": [
      "provenance.case_author",
      "provenance.runner",
      "provenance.reviewer",
      "provenance.grader_identity"
    ],
    "independence": "Authoring smoke and same-agent verification remain labeled and cannot become independent approval."
  },
  "freshness": {
    "expires_after_days": 180,
    "refresh_triggers": [
      "Skill, description, resource, or package-boundary changes",
      "Case, grader, harness, support-path, or evidence-lifecycle changes",
      "Host, model, catalog, authority, or intended-cohort changes",
      "Confirmed routing or execution failure"
    ]
  },
  "estimand": {
    "type": "fixed-suite",
    "sampling_unit": "One case, configuration, and stochastic trial.",
    "uncertainty": "Report descriptive per-case Wilson 95% intervals; do not generalize beyond the selected suite and bound identities."
  },
  "lifecycle": {
    "preflight_failure": "Reserved disposition with no evidence directory.",
    "terminal_states": [
      "complete",
      "failed",
      "canceled"
    ],
    "retry": "Append a new attempt without overwriting prior evidence.",
    "resume": "Resume only after every material identity matches."
  }
}
