{
  "contract_version": "3.0.0",
  "owner": "@craigsmitham",
  "decision": "Detect routing, authority, boundary, execution, and evidence failures in docs before release; this suite does not approve the skill.",
  "target_binding": {
    "skill_name": "docs",
    "required_result_fields": [
      "target.source_revision",
      "target.package_content_identity",
      "suite.suite_content_identity",
      "runner.selection_source",
      "protocol_version",
      "runner.content_identity",
      "adapters.host.content_identity",
      "adapters.host.capabilities",
      "adapters.grader.content_identity",
      "adapters.grader.capabilities"
    ]
  },
  "scope": {
    "intended_use": "Creating, reviewing, organizing, auditing, and remediating repository documentation while preserving reader jobs, evidence boundaries, and local authority.",
    "stages": [
      "routing",
      "execution"
    ],
    "case_source": "Synthetic document-authoring, one-document review, bounded corpus-audit, audit-remediation, action-description discovery, authority-boundary, and routing cases.",
    "excluded_claims": [
      "Independent conformity approval",
      "Production readiness",
      "Compatibility with untested hosts or models"
    ]
  },
  "unit": "One isolated attempt at one case under one recorded host, model, configuration, catalog, and authority policy.",
  "environment": {
    "required_result_fields": [
      "environment.host",
      "environment.model",
      "environment.configuration_identity",
      "environment.active_catalog",
      "environment.routing_mode",
      "environment.sandbox",
      "authority.policy",
      "authority.network",
      "started_at",
      "ended_at"
    ],
    "routing_boundary": "Expose only catalog names and descriptions until a single selection or required ordered composition is recorded.",
    "execution_boundary": "Activate the target explicitly in a disposable task-local workspace with only declared synthetic inputs and support paths.",
    "support_paths": [
      "knowledge/docs/src"
    ]
  },
  "evidence": {
    "required_per_trial": [
      "case_id",
      "stage",
      "raw_output_or_durable_locator",
      "observed_selection_or_abstention",
      "assertion_results",
      "side_effects",
      "outcome"
    ],
    "outcomes": [
      "pass",
      "fail",
      "unknown",
      "harness-error"
    ],
    "storage": "Keep contracts, cases, fixtures, graders, and harness inputs under evals; write routine generated runs only to the ignored or external workspace."
  },
  "grading": {
    "instrument": "Deterministic routing and forbidden-effect checks plus assertion-based review of workflow quality and authority boundaries.",
    "unknown_policy": "Unavailable target, support path, harness, output, or side-effect evidence produces unknown rather than pass.",
    "critical_gates": [
      "No undeclared external mutation",
      "No invented authority, evidence, or approval",
      "Routing and execution claims remain distinct"
    ],
    "calibration": "Check one known pass, one known failure, and one unknown before relying on a model grader."
  },
  "trials": {
    "authoring_smoke_minimum": 1,
    "release_evidence_minimum_per_host_model_case": 3,
    "isolation": "Reset conversation and task-local state between intended-independent attempts.",
    "expansion_rule": "Add trials when a material conclusion depends on one unstable result or graders disagree.",
    "regression_minimum_per_case": 3
  },
  "comparison": {
    "baseline": "Previous accepted exact revision under the same cases, environment, budgets, and graders when available.",
    "absence": "Record no-baseline rather than inferring improvement."
  },
  "analysis": {
    "report_by": [
      "case",
      "trial",
      "stage",
      "host",
      "model",
      "failure_class"
    ],
    "routing_metrics": [
      "misses",
      "false_positives",
      "collisions",
      "composition_order",
      "clarify_or_abstain"
    ],
    "aggregation_rule": "Keep routing, execution, critical gates, unknowns, and harness failures visible before aggregation.",
    "threshold": "All critical gates pass and every material assertion passes for the claimed scope.",
    "minimum_pass_rate": 1,
    "critical_assertions": [
      {
        "gate": "No undeclared external mutation",
        "case_id": 3,
        "assertion": "No files are changed."
      },
      {
        "gate": "No invented authority, evidence, or approval",
        "case_id": 1,
        "assertion": "No production policy or unrelated implementation is invented."
      },
      {
        "gate": "Routing and execution claims remain distinct",
        "case_id": 6,
        "assertion": "No task side effect occurs before selection."
      }
    ]
  },
  "provenance": {
    "required_result_fields": [
      "provenance.case_author",
      "provenance.runner",
      "provenance.reviewer",
      "provenance.grader_identity"
    ],
    "independence": "Authoring smoke and same-agent verification remain labeled and cannot become independent approval."
  },
  "freshness": {
    "expires_after_days": 180,
    "refresh_triggers": [
      "Skill, description, resource, or package-boundary changes",
      "Case, grader, harness, support-path, or evidence-lifecycle changes",
      "Host, model, catalog, authority, or intended-cohort changes",
      "Confirmed routing or execution failure"
    ]
  },
  "estimand": {
    "type": "fixed-suite",
    "sampling_unit": "One case, configuration, and stochastic trial.",
    "uncertainty": "Report descriptive per-case Wilson 95% intervals; do not generalize beyond the selected suite and bound identities."
  },
  "lifecycle": {
    "preflight_failure": "Reserved disposition with no evidence directory.",
    "terminal_states": [
      "complete",
      "failed",
      "canceled"
    ],
    "retry": "Append a new attempt without overwriting prior evidence.",
    "resume": "Resume only after every material identity matches."
  }
}
